faith	assent, confidence, credit, opinion, assurance, conviction, creed, reliance, belief, credence, doctrine, trust	denial, dissent, doubt, infidelity, rejection, suspicion, disbelief, distrust, incredulity, misgiving, skepticism, unbelief
faithful	devoted, incorruptible, stanch, true, trusty, firm, loyal, sure, trustworthy, unwavering	capricious, false, unfaithful, untrustworthy, faithless, fickle, untrue, wavering
fame	celebrity, eminence, honor, notoriety, reputation, credit, glory, laurels, renown, repute, distinction	contempt, discredit, dishonor, humiliation, infamy, obscurity, contumely, disgrace, disrepute, ignominy, oblivion, shame
fanaticism	bigotry, credulity, intolerance, superstition	cynicism, free-thinking, indifference, latitudinarianism
fanciful	chimerical, fantastic, grotesque, imaginative, visionary	accurate, commonplace, prosaic, regular, sound, calculable, literal, real, sensible, sure, calculated, ordinary, reasonable, solid, true
fancy	belief, desire, imagination, predilection, caprice, humor, inclination, supposition, conceit, idea, liking, vagary, conception, image, mood, whim	actuality, certainty, fact, reality, truth, verity
farewell	adieu, good-by, parting salutation, valedictory, congé, leave-taking, valediction	
fear	affright, dismay, horror, timidity, apprehension, disquietude, misgiving, trembling, awe, dread, panic, tremor, consternation, fright, terror, trepidation	
feminine	effeminate, female, womanish, womanly	
fetter	bondage, custody, gyves, irons, bonds, durance, handcuffs, manacles, chains, duress, imprisonment, shackles	
feud	affray, brawl, contest, dissension, hostility, animosity, broil, controversy, enmity, quarrel, bitterness, contention, dispute, fray, strife	
fiction	allegory, fabrication, invention, myth, romance, apologue, falsehood, legend, novel, story, fable, figment	certainty, fact, history, literalness, reality, truth, verity
fierce	ferocious, furious, raging, uncultivated, violent, fiery, impetuous, savage, untrained, wild	affectionate, gentle, kind, patient, submissive, tame, docile, harmless, mild, peaceful, sweet, tender
financial	fiscal, monetary, pecuniary	
fine	beautiful, excellent, polished, small, clarified, exquisite, pure, smooth, clear, gauzy, refined, splendid, comminuted, handsome, sensitive, subtile, dainty, keen, sharp, subtle, delicate, minute, slender, tenuous, elegant, nice, slight, thin	big, clumsy, great, huge, large, stout, blunt, coarse, heavy, immense, rude, thick
fire	blaze, burning, combustion, conflagration, flame	
flock	bevy, covey, group, herd, lot, set, brood, drove, hatch, litter, pack, swarm	
fluctuate	hesitate, swerve, vacillate, veer, oscillate, undulate, vary, waver	abide, adhere, hold fast, persist, stand fast, stay, stick
fluid	gas, liquid	
follow	accompany, come after, go after, obey, pursue, attend, copy, heed, observe, result, chase, ensue, imitate, practise, succeed	
food	aliment, feed, nourishment, pabulum, sustenance, diet, fodder, nutriment, provender, viands, fare, forage, nutrition, regimen, victuals	
formidable	dangerous, redoubted, terrible, tremendous	contemptible, despicable, feeble, harmless, helpless, powerless, weak
fortification	castle, citadel, fastness, fort, fortress, stronghold	
fortitude	courage, endurance, heroism, resolution	
fortunate	favored, lucky, prospered, prosperous, successful, happy	broken, fallen, miserable, unhappy, woful, crushed, ill-starred, unfortunate, unlucky, wretched
fraud	artifice, deceit, duplicity, swindle, treason, cheat, deception, imposition, swindling, trick, cheating, dishonesty, imposture, treachery	fairness, good faith, honesty, integrity, truth, uprightness
friendly	accessible, companionable, genial, neighborly, affable, complaisant, hearty, sociable, affectionate, cordial, kind, social, amicable, favorable, kindly, tender, brotherly, fond, loving, well-disposed	adverse, bellicose, contentious, estranged, ill-disposed, unfriendly, alienated, belligerent, disaffected, frigid, indifferent, unkind, antagonistic, cold, distant, hostile, inimical, warlike
friendship	affection, comity, esteem, good will, amity, consideration, favor, love, attachment, devotion, friendliness, regard	
frighten	affright, appal, cow, dismay, scare, alarm, browbeat, daunt, intimidate, terrify	
frugality	economy, parsimony, saving, sparing, miserliness, providence, scrimping, thrift, parsimoniousness, prudence	abundance, bounty, liberality, opulence, waste, affluence, extravagance, luxury, riches, wealth
garrulous	chattering, loquacious, talkative, verbose	laconic, reserved, reticent, silent, speechless, taciturn
general	common, familiar, ordinary, universal, commonplace, frequent, popular, usual, customary, habitual, prevalent, everyday, normal, public	exceptional, infrequent, rare, singular, uncommon, unknown, unusual
generous	bountiful, free, liberal, noble, chivalrous, free-handed, magnanimous, open-handed, disinterested, free-hearted, munificent, open-hearted	avaricious, covetous, ignoble, mean, niggardly, penurious, rapacious, close, greedy, illiberal, miserly, parsimonious, petty, stingy
genius	talent, talents	dulness, folly, imbecility, obtuseness, senselessness, stupidity
get	achieve, attain, gain, procure, secure, acquire, earn, obtain, receive, win	
gift	benefaction, boon, bribe, grant, largess, bequest, bounty, donation, gratuity, present	compensation, earnings, guerdon, penalty, remuneration wages
give	bestow, communicate, deliver, grant, supply, cede, confer, furnish, impart	
govern	command, curb, influence, mold, reign over, rule, control, direct, manage, reign, restrain, sway	be in subjection, be subject, comply, obey, submit, yield
grief	affliction, melancholy, regret, sorrow, trouble, distress, mourning, sadness, tribulation, wo	
habit	custom, habitude, routine, system, use, fashion, practise, rule, usage, wont	
happen	bechance, chance, fall out, supervene, befall, come to pass, occur, take place, betide, fall	
happiness	blessedness, delight, gladness, pleasure, bliss, ecstasy, gratification, rapture, cheer, enjoyment, joy, rejoicing, comfort, felicity, merriment, satisfaction, contentment, gaiety, mirth, triumph	
happy	blessed, cheering, gay, lucky, rejoiced, blissful, cheery, glad, merry, rejoicing, blithe, delighted, jocund, mirthful, smiling, blithesome, delightful, jolly, pleased, sprightly, bright, dexterous, joyful, prosperous, successful, buoyant, felicitous, joyous, rapturous, sunny, cheerful, fortunate	
harmony	accord, concurrence, consistency, uniformity, accordance, conformity, consonance, union, agreement, congruity, symmetry, unison, amity, consent, unanimity, unity, concord	antagonism, contest, discord, hostility, schism, battle, controversy, disproportion, incongruity, separation, conflict, difference, dissension, inconsistency, variance, contention, disagreement, disunion, opposition, warfare
harvest	crop, harvest-home, ingathering, result, fruit, harvesting, proceeds, return, growth, harvest-tide, produce, yield, harvest-feast, harvest-time, product, harvest-festival, increase, reaping	
hatred	abhorrence, detestation, hostility, rancor, anger, dislike, ill will, repugnance, animosity, enmity, malevolence, resentment, antipathy, grudge, malice, revenge, aversion, hate, malignity, spite	
have	be in possession of, hold, occupy, own, possess, be possessed of	
hazard	accident, chance, danger, jeopardy, risk, casualty, contingency, fortuity, peril, venture	assurance, necessity, protection, safety, surety, certainty, plan, safeguard, security
healthy	hale, hygienic, sanitary, vigorous, healthful, salubrious, sound, well, hearty, salutary, strong, wholesome	delicate, failing, ill, unsound, worn, diseased, fainting, sick, wasted, worn down, emaciated, fragile, unhealthy, weak, worn out, exhausted, frail
help	abet, befriend, foster, succor, uphold, aid, cooperate, second, support, assist, encourage, stand by, sustain	counteract, discourage, oppose, resist, thwart, withstand
heretic	dissenter, heresiarch, non-conformist, schismatic	
heterogeneous	confused, mingled, unhomogeneous, conglomerate, miscellaneous, unlike, discordant, mixed, variant, dissimilar, non-homogeneous, various	alike, homogeneous, identical, like, pure, same, similar, uniform
hide	bury, cover, entomb, overwhelm, suppress, cloak, disguise, inter, screen, veil, conceal, dissemble, mask, secrete	admit, disclose, exhume, manifest, show, advertise, discover, expose, promulgate, tell, avow, disinter, lay bare, publish, uncover, betray, divulge, lay open, raise, unmask, confess, exhibit, make known reveal, unveil
high	elevated, exalted, noble, steep, towering, eminent, lofty, proud, tall, uplifted	base, deep, degraded, depressed, dwarfed, inferior, low, mean, short, stunted
hinder	baffle, clog, foil, obstruct, retard, balk, counteract, frustrate, oppose, stay, bar, delay, hamper, prevent, stop, block, embarrass, impede, resist, thwart, check, encumber, interrupt	
history	account, biography, muniment, record, annals, chronicle, narration, register, archives, memoir, narrative, story, autobiography, memorial, recital	
holy	blessed, devoted, hallowed, saintly, consecrated, divine, sacred, set apart	abominable, cursed, polluted, unconsecrated, unholy, wicked, common, impure, secular, unhallowed, unsanctified, worldly
home	abode, dwelling, habitation, hearthstone, ingleside, domicil, fireside, hearth, house, residence	
honest	candid, frank, ingenuous, true, equitable, genuine, just, trustworthy, fair, good, sincere, trusty, faithful, honorable, straightforward, upright	deceitful, faithless, hypocritical, perfidious, unfaithful, dishonest, false, lying, traitorous, unscrupulous, disingenuous, fraudulent, mendacious, treacherous, untrue
horizontal	even, flat, level, plain, plane	broken, inclined, rolling, rugged, sloping, hilly, irregular, rough, slanting, uneven
humane	benevolent, compassionate, human, pitying, benignant, forgiving, kind, sympathetic, charitable, gentle, kind-hearted, tender, clement, gracious, merciful, tender-hearted	
hunt	chase, hunting, inquisition, pursuit, search	
hypocrisy	affectation, formalism, pretense, sanctimony, cant, pharisaism, sanctimoniousness, sham, dissimulation, pietism	candor, genuineness, ingenuousness, sincerity, truth, frankness, honesty, openness, transparency, truthfulness
hypocrite	cheat, deceiver, dissembler, impostor, pretender	
hypothesis	conjecture, scheme, supposition, system, guess, speculation, surmise, theory	certainty, demonstration, discovery, evidence, fact, proof
idea	apprehension, design, impression, plan, archetype, fancy, judgment, purpose, belief, fantasy, model, sentiment, conceit, ideal, notion, supposition, concept, image, opinion, theory, conception, imagination, pattern, thought	actuality, fact, reality, substance
ideal	archetype, model, pattern, prototype, standard, idea, original	accomplishment, action, doing, fact, practise, achievement, attainment, embodiment, incarnation, reality, act, development, execution, performance, realization
idiocy	fatuity, foolishness, incapacity, stupidity, folly, imbecility, senselessness	acuteness, brilliancy, common sense, sagacity, soundness, astuteness, capacity, intelligence, sense, wisdom
idle	inactive, inert, slothful, trifling, unoccupied, indolent, lazy, sluggish, unemployed, vacant	active, busy, diligent, employed, industrious, occupied, working
ignorant	ill-informed, unenlightened, unlearned, untaught, illiterate, uninformed, unlettered, untutored, uneducated, uninstructed, unskilled	educated, instructed, learned, sage, skilled, trained, well-informed, wise
imagination	fancy, fantasy, phantasy	
immediately	at once, instanter, presently, straightway, directly, instantly, right away, this instant, forthwith, now, right off, without delay	after a while, by and by, hereafter, in the future, some time
immerse	bury, dip, douse, duck, immerge, plunge, sink, submerge	
imminent	impending, threatening	chimerical, contingent, doubtful, improbable, problematical, unexpected, unlikely
impediment	bar, clog, encumbrance, obstacle, barrier, difficulty, hindrance, obstruction	advantage, aid, assistance, benefit, help, relief, succor
impudence	assurance, impertinence, intrusiveness, presumption, boldness, incivility, officiousness, rudeness, effrontery, insolence, pertness, sauciness, forwardness	bashfulness, diffidence, lowliness, modesty, coyness, humility, meekness, submissiveness
incongruous	absurd, ill-matched, inharmonious, conflicting, inapposite, irreconcilable, contradictory, inappropriate, mismatched, contrary, incommensurable, mismated, discordant, incompatible, repugnant, discrepant, inconsistent, unsuitable	accordant, agreeing, compatible, consistent, harmonious, suitable
induction	deduction, inference	
industrious	active, busy, employed, occupied, assiduous, diligent, engaged, sedulous	
industry	application, diligence, labor, persistence, assiduity, effort, pains, sedulousness, attention, exertion, patience, constancy, intentness, perseverance	changeableness, idleness, inconstancy, neglect, remissness, fickleness, inattention, indolence, negligence, sloth
infinite	absolute, illimitable, limitless, unconditioned, boundless, immeasurable, measureless, unfathomable, countless, innumerable, numberless, unlimited, eternal, interminable, unbounded, unmeasured	bounded, finite, measurable, restricted, small, brief, limited, moderate, shallow, transient, circumscribed, little, narrow, short, transitory, evanescent
influence	actuate, draw, impel, induce, move, stir, compel, drive, incite, instigate, persuade, sway, dispose, excite, incline, lead, prompt, urge	deter, dissuade, impede, prevent, restrain, retard, discourage, hinder, inhibit
inherent	congenital, indispensable, innate, native, essential, indwelling, inseparable, natural, immanent, infixed, internal, subjective, inborn, ingrained, intrinsic, inbred, inhering, inwrought	accidental, extrinsic, outward, superficial, supplemental, casual, fortuitous, subsidiary, superfluous, transient, external, incidental, superadded, superimposed, unconnected
injury	blemish, disadvantage, hurt, loss, prejudice, damage, evil, impairment, mischief, wrong, detriment, harm, injustice, outrage	advantage, benefit, boon, improvement, service, amelioration, blessing, help, remedy, utility
injustice	grievance, injury, unfairness, unrighteousness, wrong, iniquity	equity, faithfulness, impartiality, lawfulness, righteousness, fairness, honesty, integrity, rectitude, uprightness, fair play, honor, justice, right
innocent	blameless, guiltless, inoffensive, spotless, clean, harmless, pure, stainless, clear, immaculate, right, upright, faultless, innocuous, righteous, virtuous, guileless, innoxious, sinless	
inquisitive	curious, meddlesome, peeping, scrutinizing, inquiring, meddling, prying, searching, intrusive	apathetic, heedless, indifferent, unconcerned, uninterested, careless, inattentive
insanity	aberration, delirium, frenzy, madness, alienation, dementia, hallucination, mania, craziness, derangement, lunacy, monomania	clearness, good sense, lucidity, rationality, sanity
interpose	arbitrate, intercept, intermeddle, meddle, intercede, interfere, interrupt, mediate	avoid, keep aloof, keep out, retire, stand back, hold aloof, keep away, let alone, stand aside, stand off, hold off, keep clear, let be, stand away, withdraw
involve	complicate, embroil, implicate, include, embarrass, entangle, imply, overwhelm	disconnect, disentangle, distinguish, explicate, extricate, remove, separate
journey	excursion, pilgrimage, transit, trip, expedition, tour, travel, voyage	
judge	arbiter, arbitrator, justice, referee, umpire	
justice	equity, impartiality, legality, rightfulness, fairness, integrity, rectitude, truth, fair play, justness, right, uprightness, faithfulness, law, righteousness, virtue, honor, lawfulness	dishonesty, inequity, partiality, unlawfulness, untruth, favoritism, injustice, unfairness, unreasonableness, wrong
keep	carry, defend, hold, preserve, retain, carry on, detain, maintain, protect, support, celebrate, fulfil, obey, refrain, sustain, conduct, guard, observe, restrain, withhold	
kill	assassinate, despatch, massacre, put to death, slay, butcher, execute, murder, slaughter	
kin	affinity, blood, descent, kind, race, alliance, consanguinity, family, kindred, relationship, birth	
knowledge	acquaintance, erudition, learning, recognition, apprehension, experience, light, scholarship, cognition, information, lore, science, cognizance, intelligence, perception, wisdom, comprehension, intuition	ignorance, inexperience, misconception, rudeness, illiteracy, misapprehension, misunderstanding, unfamiliarity
language	barbarism, expression, patois, vernacular, dialect, idiom, speech, vocabulary, diction, mother tongue, tongue	
large	abundant, coarse, gigantic, long, ample, colossal, grand, massive, big, commodious, great, spacious, broad, considerable, huge, vast, bulky, enormous, immense, wide, capacious, extensive	brief, infinitesimal, little, minute, petty, slender, tiny, diminutive, insignificant, mean, narrow, scanty, slight, trifling, inconsiderable, limited, microscopic, paltry, short, small, trivial
law	canon, economy, legislation, principle, code, edict, mandate, regulation, command, enactment, order, rule, commandment, formula, ordinance, statute, decree, jurisprudence, polity	
liberty	emancipation, freedom, independence, license	captivity, imprisonment, oppression, slavery, compulsion, necessity, serfdom, superstition, constraint, obligation, servitude, thraldom
light	blaze, gleam, glow, shimmer, flame, gleaming, illumination, shine, flare, glimmer, incandescence, shining, flash, glistening, luster, sparkle, flicker, glistering, scintillation, twinkle, glare, glitter, sheen, twinkling	blackness, darkness, dusk, gloominess, shade, dark, dimness, gloom, obscurity, shadow
likely	apt, conceivable, liable, probable, credible, conjectural, presumable, reasonable	doubtful, improbable, questionable, unreasonable, dubious, incredible, unlikely
listen	attend, hark, harken, hear, heed, list	be deaf to, ignore, neglect, scorn, slight
literature	belles-lettres, literary productions, publications, books, literary works, writings	
load	burden, charge, encumbrance, incubus, pack, cargo, clog, freight, lading, weight	
lock	bar, catch, fastening, hook, bolt, clasp, hasp, latch	
look	behold, discern, inspect, see, view, contemplate, gaze, regard, stare, watch, descry, glance, scan, survey	
love	affection, charity, friendship, regard, attachment, devotion, liking, tenderness, attraction, fondness	
make	become, constrain, fabricate, manufacture, bring about, construct, fashion, occasion, bring into being, create, force, perform, bring to pass, do, frame, reach, cause, effect, get, render, compel, establish, make out, require, compose, execute, make up, shape, constitute	
marriage	conjugal union, espousals, nuptials, spousals, wedding, espousal, matrimony, spousal, union, wedlock	bachelorhood, celibacy, divorce, maidenhood, virginity, widowhood
masculine	male, manful, manlike, manly, mannish, virile	
massacre	butchery, carnage, havoc, slaughter	
meddlesome	impertinent, intrusive, meddling, obtrusive, officious	modest, reserved, retiring, shy, unassuming, unobtrusive
melody	harmony, music, symphony, unison	
memory	recollection, reminiscence, retrospect, retrospection, remembrance	forgetfulness, oblivion, obliviousness, oversight, unconsciousness
mercy	benevolence, favor, kindness, mildness, benignity, forbearance, lenience, pardon, blessing, forgiveness, leniency, pity, clemency, gentleness, lenity, tenderness, compassion, grace	cruelty, implacability, punishment, rigor, sternness, hardness, justice, revenge, severity, vengeance, harshness, penalty
meter	euphony, measure, rhythm, verse	
mind	brain, instinct, reason, spirit, consciousness, intellect, sense, thought, disposition, intelligence, soul, understanding	body, brawn, brute force, material substance, matter
minute	circumstantial, diminutive, little, slender, comminuted, exact, particular, small, critical, fine, precise, tiny, detailed	
misfortune	adversity, disappointment, ill fortune, ruin, affliction, disaster, ill luck, sorrow, bereavement, distress, misadventure, stroke, blow, failure, mischance, trial, calamity, hardship, misery, tribulation, chastening, harm, mishap, trouble, chastisement, ill, reverse, visitation	blessing, consolation, gratification, pleasure, success, boon, good fortune, happiness, prosperity, triumph, comfort, good luck, joy, relief
mob	canaille, dregs of the people, masses, rabble, crowd, lower classes, populace, the vulgar	
model	archetype, facsimile, original, representation, copy, image, pattern, standard, design, imitation, prototype, type, example, mold	
modesty	backwardness, constraint, reserve, timidity, bashfulness, coyness, shyness, unobtrusiveness, coldness, diffidence	abandon, boldness, forwardness, impudence, pertness, sociability, arrogance, conceit, frankness, indiscretion, sauciness, assumption, confidence, freedom, loquaciousness, self-conceit, assurance, egotism, haughtiness, loquacity, self-sufficiency
money	bills, cash, funds, property, bullion, coin, gold, silver, capital, currency, notes, specie	
morose	acrimonious, dogged, ill-natured, splenetic, churlish, gloomy, severe, sulky, crabbed, gruff, snappish, sullen, crusty, ill-humored, sour, surly	amiable, complaisant, gentle, kind, pleasant, benignant, friendly, good-natured, loving, sympathetic, bland, genial, indulgent, mild, tender
motion	act, change, movement, process, transition, action, move, passage, transit	immobility, quiescence, quiet, repose, rest, stillness
mourn	bemoan, deplore, lament, regret, rue, sorrow, bewail, grieve	be joyful, exult, joy, make merry, rejoice, triumph
mutual	common, correlative, interchangeable, joint, reciprocal	detached, distinct, separate, severed, unconnected, unrequited, disconnected, disunited, separated, sundered, unreciprocated, unshared, dissociated
mysterious	abstruse, inexplicable, recondite, cabalistic, inscrutable, secret, dark, mystic, transcendental, enigmatical, mystical, unfathomable, hidden, obscure, unfathomed, incomprehensible, occult, unknown	
name	agnomen, denomination, prenomen, surname, appellation, designation, style, title, cognomen, epithet	
native	indigenous, innate, natal, natural, original	acquired, alien, artificial, assumed, foreign, unnatural
nautical	marine, maritime, naval, ocean, oceanic	
neat	clean, dapper, nice, prim, tidy, cleanly, natty, orderly, spruce, trim	dirty, negligent, slouchy, uncared for, disorderly, rough, slovenly, unkempt, dowdy, rude, soiled, untidy
necessary	essential, infallible, required, unavoidable, indispensable, needed, requisite, undeniable, inevitable, needful	casual, needless, optional, useless, contingent, non-essential, unnecessary, worthless
necessity	compulsion, fatality, requisite, destiny, fate, sine qua non, emergency, indispensability, unavoidableness, essential, indispensableness, urgency, exigency, need, want, extremity, requirement	choice, doubt, dubiousness, freedom, possibility, contingency, doubtfulness, fortuity, option, uncertainty
neglect	carelessness, heedlessness, negligence, scorn, default, inadvertence, omission, slackness, disregard, inattention, oversight, slight, disrespect, indifference, remissness, thoughtlessness, failure, neglectfulness	
new	fresh, modern, new-made, upstart, juvenile, new-fangled, novel, young, late, new-fashioned, recent, youthful	
nimble	active, alert, bustling, prompt, speedy, spry, agile, brisk, lively, quick, sprightly, swift	clumsy, dilatory, dull, heavy, inactive, inert, slow, sluggish, unready
normal	common, natural, ordinary, regular, typical, usual	abnormal, irregular, peculiar, singular, unprecedented, exceptional, monstrous, rare, uncommon, unusual
notwithstanding	altho(ugh), howbeit, nevertheless, tho(ugh), but, however, still, yet	
notwithstanding	despite, in spite of	
oath	adjuration, curse, profane swearing, affidavit, cursing, profanity, anathema, denunciation, reprobation, ban, execration, swearing, blaspheming, imprecation, sworn statement, blasphemy, malediction, vow	benediction, benison, blessing
obscure	abstruse, darksome, dusky, involved, ambiguous, deep, enigmatical, muddy, cloudy, dense, hidden, mysterious, complex, difficult, incomprehensible, profound, complicated, dim, indistinct, turbid, dark, doubtful, intricate, unintelligible	
obsolete	ancient, archaic, obsolescent, out of date, antiquated, disused, old, rare	
obstinate	contumacious, headstrong, mulish, resolute, decided, heady, obdurate, resolved, determined, immovable, opinionated, stubborn, dogged, indomitable, persistent, unconquerable, firm, inflexible, pertinacious, unflinching, fixed, intractable, refractory, unyielding	amenable, dutiful, pliable, tractable, complaisant, gentle, pliant, undecided, compliant, irresolute, submissive, wavering, docile, obedient, teachable, yielding
obstruct	arrest, check, embarrass, interrupt, stay, bar, choke, hinder, oppose, stop, barricade, clog, impede, retard	accelerate, aid, facilitate, free, open, promote, advance, clear, forward, further, pave the way for
old	aged, decrepit, immemorial, senile, ancient, elderly, olden, time-honored, antiquated, gray, patriarchal, time-worn, antique, hoary, remote, venerable	
operation	action, effect, force, performance, result, agency, execution, influence, procedure	failure, ineffectiveness, inutility, powerlessness, uselessness, inaction, inefficiency
order	command, injunction, mandate, requirement, direction, instruction, prohibition	allowance, consent, leave, liberty, license, permission, permit
ostentation	boast, flourish, parade, pompousness, vaunt, boasting, pageant, pomp, show, vaunting, display, pageantry, pomposity	diffidence, quietness, retirement, timidity, modesty, reserve, shrinking, unobtrusiveness
