benevolence	almsgiving, charity, kind-heartedness, munificence, beneficence, generosity, kindliness, philanthropy, benignity, good-will, kindness, sympathy, bounty, humanity, liberality, unselfishness	barbarity, greediness, ill-will, malignity, self-seeking, brutality, harshness, inhumanity, niggardliness, stinginess, churlishness, illiberality, malevolence, selfishness, unkindness
bind	compel, fetter, oblige, restrict, shackle, engage, fix, restrain, secure, tie, fasten	free, loose, set free, unbind, unfasten, unloose, untie
bitter	acerb, acidulous, caustic, pungent, stinging, acetous, acrid, cutting, savage, tart, acid, acrimonious, harsh, sharp, vinegarish, acidulated, biting, irate, sour, virulent	dulcet, honeyed, luscious, nectared, saccharine, sweet
bleach	blanch, make white, whiten, whitewash	blacken, color, darken, dye, soil, stain
blemish	blot, defacement, disgrace, injury, spot, blur, defect, dishonor, reproach, stain, brand, deformity, fault, smirch, stigma, crack, dent, flaw, soil, taint, daub, disfigurement, imperfection, speck, tarnish	
blow	box, concussion, disaster, misfortune, stripe, buffet, cuff, knock, rap, stroke, calamity, cut, lash, shock, thump	
bluff	abrupt, brusk, impolite, rough, blunt, coarse, inconsiderate, rude, blustering, discourteous, open, uncivil, bold, frank, plain-spoken, unmannerly	bland, courteous, genial, polished, polite, refined, reserved, urbane
body	ashes, clay, dust, frame, system, carcass, corpse, form, remains, trunk	intellect, intelligence, mind, soul, spirit
both	twain, two	each, either, every, neither, none, no one, not any
boundary	barrier, confines, limit, margin, border, edge, line, term, bound, enclosure, marches, termination, bourn, frontier, marge, verge, bourne, landmark	center, citadel, estate, inside, interior, land, region, territory
brave	adventurous, courageous, fearless, undaunted, bold, daring, gallant, undismayed, chivalric, dauntless, heroic, valiant, chivalrous, doughty, intrepid, venturesome	afraid, cringing, fearful, pusillanimous, timid, cowardly, faint-hearted, frightened, shrinking, timorous
break	bankrupt, crack, destroy, rive, shatter, split, burst, crush, fracture, rupture, shiver, sunder, cashier, demolish, rend, sever, smash, transgress	attach, bind, fasten, join, mend, secure, solder, unite, weld
brutish	animal, brutal, ignorant, sensual, swinish, base, brute, imbruted, sottish, unintellectual, beastly, carnal, insensible, stolid, unspiritual, bestial, coarse, lascivious, stupid, vile	elevated, exalted, great, intellectual, noble, enlightened, grand, humane, intelligent, refined
burn	blaze, char, flame, incinerate, set fire to, brand, consume, flash, kindle, set on fire, cauterize, cremate, ignite, scorch, singe	cool, extinguish, put out, smother, stifle, subdue
business	affair, commerce, handicraft, trading, art, concern, job, traffic, avocation, craft, occupation, transaction, barter, duty, profession, vocation, calling, employment, trade, work	
but	and, however, notwithstanding, that, barely, just, only, tho, besides, merely, provided, unless, except, moreover, save, yet, further, nevertheless, still	
by	by dint of, by means of, through, with	
cabal	combination, confederacy, crew, gang, conclave, conspiracy, faction, junto	
calculate	account, consider, enumerate, rate, cast, count, estimate, reckon, compute, deem, number, sum up	
call	bawl, cry (out), roar, shriek, bellow, ejaculate, scream, vociferate, clamor, exclaim, shout, yell	be silent, be still, hark, hearken, hush, list, listen
calm	collected, imperturbable, sedate, still, composed, peaceful, self-possessed, tranquil, cool, placid, serene, undisturbed, dispassionate, quiet, smooth, unruffled	agitated, excited, frenzied, passionate, ruffled, violent, boisterous, fierce, furious, raging, stormy, wild, disturbed, frantic, heated, roused, turbulent, wrathful
cancel	abolish, discharge, nullify, rescind, abrogate, efface, obliterate, revoke, annul, erase, quash, rub off or out, blot out, expunge, remove, scratch out, cross off or out, make void, repeal, vacate	approve, enact, establish, perpetuate, reenact, uphold, confirm, enforce, maintain, record, sustain, write
candid	aboveboard, honest, open, truthful, artless, impartial, simple, unbiased, fair, ingenuous, sincere, unprejudiced, frank, innocent, straightforward, unreserved, guileless, naive, transparent, unsophisticated	adroit, cunning, diplomatic, intriguing, sharp, subtle, artful, deceitful, foxy, knowing, shrewd, tricky, crafty, designing, insincere, maneuvering, sly, wily
caparison	accouterments, harness, housings, trappings	
capital	chief city, metropolis, seat of government	
care	anxiety, concern, oversight, trouble, attention, direction, perplexity, vigilance, caution, forethought, precaution, wariness, charge, heed, prudence, watchfulness, circumspection, management, solicitude, worry	carelessness, heedlessness, indifference, negligence, oversight, remissness, disregard, inattention, neglect, omission, recklessness, slight
career	charge, flight, passage, race, course, line of achievement, public life, rush	
caress	coddle, embrace, fondle, pamper, court, flatter, kiss, pet	
caricature	burlesque, extravaganza, mimicry, take-off, exaggeration, imitation, parody, travesty	
carry	bear, convey, move, sustain, transmit, bring, lift, remove, take, transport	drop, fall under, give up, let go, shake off, throw down, throw off
catastrophe	calamity, denouement, mischance, mishap, cataclysm, disaster, misfortune, sequel	benefit, boon, favor, pleasure, prosperity, blessing, comfort, help, privilege, success
catch	apprehend, comprehend, grasp, overtake, snatch, capture, discover, grip, secure, take, clasp, ensnare, gripe, seize, take hold of, clutch, entrap, lay hold of (on upon)	fail of, give up, lose, release, throw aside, fall short of, let go, miss, restore, throw away
cause	actor, causality, designer, occasion, precedent, agent, causation, former, origin, reason, antecedent, condition, fountain, originator, source, author, creator, motive, power, spring	consequence, development, end, fruit, outcome, product, creation, effect, event, issue, outgrowth, result
cease	abstain, desist, give over, quit, bring to an end, discontinue, intermit, refrain, come to an end, end, leave off, stop, conclude, finish, pause, terminate	begin, enter upon, initiate, originate, set going, set on foot, commence, inaugurate, institute, set about, set in operation, start
celebrate	commemorate, keep, observe, solemnize	contemn, dishonor, forget, neglect, profane, despise, disregard, ignore, overlook, violate
center	middle, midst	bound, boundary, circumference, perimeter, rim
chagrin	confusion, discomposure, humiliation, shame, disappointment, dismay, mortification, vexation	delight, exultation, glory, rejoicing, triumph
change	alter, exchange, shift, transmute, commute, metamorphose, substitute, turn, convert, modify, transfigure, vary, diversify, qualify, transform, veer	abide, continue, hold, persist, retain, bide, endure, keep, remain, stay
change	alteration, mutation, renewing, transmutation, conversion, novelty, revolution, variation, diversity, regeneration, transformation, variety, innovation, renewal, transition, vicissitude	constancy, fixedness, invariability, steadiness, continuance, fixity, permanence, unchangeableness, firmness, identity, persistence, uniformity
character	constitution, genius, personality, reputation, temper, disposition, nature, record, spirit, temperament	
characteristic	attribute, feature, peculiarity, sign, trace, character, indication, property, singularity, trait, distinction, mark, quality	
charming	bewitching, delightful, enrapturing, fascinating, captivating, enchanting, entrancing, winning	
chasten	afflict, chastise, discipline, punish, refine, subdue, castigate, correct, humble, purify, soften, try	
cherish	cheer, encourage, harbor, nurse, shelter, cling to, entertain, hold dear, nurture, treasure, comfort, foster, nourish, protect, value	
choose	cull, elect, pick, pick out, prefer, select	cast away, decline, dismiss, refuse, repudiate, cast out, disclaim, leave, reject, throw aside
circumlocution	diffuseness, prolixity, surplusage, verbiage, periphrasis, redundance, tautology, verbosity, pleonasm, redundancy, tediousness, wordiness	brevity, compression, condensation, plainness, succinctness, compactness, conciseness, directness, shortness, terseness
circumstance	accompaniment, fact, item, point, concomitant, feature, occurrence, position, detail, incident, particular, situation, event	
class	association, circle, clique, company, grade, rank, caste, clan, club, coterie, order, set	
cleanse	brush, dust, purify, scour, sponge, wash, clean, lave, rinse, scrub, sweep, wipe, disinfect, mop	befoul, besmirch, contaminate, debase, deprave, soil, stain, taint, besmear, bespatter, corrupt, defile, pollute, spoil, sully, vitiate
clear	apparent, intelligible, pellucid, transparent, diaphanous, limpid, perspicuous, unadorned, distinct, lucid, plain, unambiguous, evident, manifest, straightforward, unequivocal, explicit, obvious, translucent, unmistakable	ambiguous, dim, foggy, mysterious, opaque, unintelligible, cloudy, dubious, indistinct, obscure, turbid, vague
clever	able, capable, happy, keen, sharp, adroit, dexterous, ingenious, knowing, skilful, apt, expert, intellectual, quick, smart, bright, gifted, intelligent, quick-witted, talented	awkward, clumsy, foolish, ignorant, slow, thick-headed, bungling, dull, idiotic, senseless, stupid, witless
collision	clash, concussion, contact, impact, opposition, clashing, conflict, encounter, meeting, shock	agreement, coincidence, concord, conformity, unison, amity, concert, concurrence, harmony, unity
comfortable	agreeable, cheery, genial, snug, at ease, commodious, pleasant, well-off, at rest, contented, satisfactory, well-provided, cheerful, convenient, satisfied, well-to-do	cheerless, discontented, distressed, forlorn, uncomfortable, disagreeable, dissatisfied, dreary, miserable, wretched
commit	assign, confide, consign, entrust, relegate, trust	
company	assemblage, concourse, convocation, host, assembly, conference, crowd, meeting, collection, congregation, gathering, multitude, conclave, convention, group, throng	dispersion, loneliness, privacy, retirement, seclusion, solitude
compel	coerce, drive, make, oblige, constrain, force, necessitate	
complain	croak, growl, grunt, remonstrate, find fault, grumble, murmur, repine	applaud, approve, commend, eulogize, laud, praise
complex	abstruse, confused, intricate, mixed, complicated, conglomerate, involved, multiform, composite, entangled, manifold, obscure, compound, heterogeneous, mingled, tangled	clear, homogeneous, plain, uncombined, uniform, direct, obvious, simple, uncompounded, unraveled
condemn	blame, convict, doom, reprove, censure, denounce, reprobate, sentence	absolve, applaud, exonerate, pardon, acquit, approve, justify, praise
confess	accept, allow, concede, grant, acknowledge, avow, disclose, own, admit, certify, endorse, recognize	cloak, deny, disown, hide, screen, conceal, disavow, dissemble, mask, secrete, cover, disguise, dissimulate, repudiate, veil
confirm	assure, fix, sanction, substantiate, corroborate, prove, settle, sustain, establish, ratify, strengthen, uphold	abrogate, cancel, overthrow, shatter, upset, annul, destroy, shake, unsettle, weaken
congratulate		condole with, console
conquer	beat, humble, overthrow, subject, checkmate, master, prevail over, subjugate, crush, overcome, put down, surmount, defeat, overmaster, reduce, vanquish, discomfit, overmatch, rout, win, down, overpower, subdue, worst	capitulate, fail, fly, lose, retire, submit, surrender, cede, fall, forfeit, resign, retreat, succumb, yield
conscious	advised, assured, certain, cognizant, sensible, apprised, aware, certified, informed, sure	cold, dead, deaf, ignorant, insensible, unaware, unconscious
consequence	consequent, end, issue, outgrowth, sequel, effect, event, outcome, result, upshot	
console	comfort, condole with, encourage, sympathize with	annoy, distress, disturb, grieve, hurt, sadden, trouble, wound
continual	ceaseless, incessant, regular, uninterrupted, constant, invariable, unbroken, unremitting, continuous, perpetual, unceasing, unvarying	
contract	agreement, cartel, engagement, pledge, arrangement, compact, obligation, promise, bargain, covenant, pact, stipulation	
contrast	compare, differentiate, discriminate, oppose	
conversation	chat, communion, converse, intercourse, colloquy, confabulation, dialogue, parley, communication, conference, discourse, talk	
convert	disciple, neophyte, proselyte	
convey	carry, give, remove, shift, transmit, change, move, sell, transfer, transport	cling to, hold, keep, possess, preserve, retain
convoke	assemble, call together, convene, muster, call, collect, gather, summon	adjourn, disband, dismiss, dissolve, scatter, break up, discharge, disperse, prorogue, separate
criminal	abominable, flagitious, immoral, sinful, vile, culpable, guilty, iniquitous, unlawful, wicked, felonious, illegal, nefarious, vicious, wrong	innocent, lawful, meritorious, right, just, legal, moral, virtuous
daily		nightly, nocturnal
danger	hazard, insecurity, jeopardy, peril, risk	defense, immunity, protection, safeguard, safety, security, shelter
dark	black, dusky, mysterious, sable, somber, dim, gloomy, obscure, shadowy, swart, dismal, murky, opaque, shady, swarthy	bright, crystalline, glowing, lucid, shining, brilliant, dazzling, illumined, luminous, transparent, clear, gleaming, light, radiant, white
decay	corrupt, decompose, molder, putrefy, rot, spoil	
deception	craft, dissimulation, finesse, lie, cunning, double-dealing, fraud, lying, deceit, duplicity, guile, prevarication, deceitfulness, fabrication, hypocrisy, trickery, delusion, falsehood, imposition, untruth	candor, frankness, honesty, simplicity, truth, fair dealing, guilelessness, openness, sincerity, veracity
defense	apology, guard, rampart, shelter, bulwark, justification, resistance, shield, fortress, protection, safeguard, vindication	abandonment, betrayal, capitulation, desertion, flight, surrender
defile	befoul, corrupt, pollute, spoil, sully, tarnish, contaminate, infect, soil, stain, taint, vitiate	clean, cleanse, disinfect, hallow, purify, sanctify, wash
definition	comment, description, exposition, rendering, commentary, explanation, interpretation, translation	
delegate	deputy, legate, proxy, representative, substitute	
deliberate	confer, consult, meditate, reflect, consider, debate, ponder, weigh	
delicious	dainty, delightful, exquisite, luscious, savory	acrid, bitter, loathsome, nauseous, repulsive, unpalatable, unsavory
delightful	acceptable, delicious, pleasant, refreshing, agreeable, grateful, pleasing, satisfying, congenial, gratifying, pleasurable, welcome	depressing, distressing, horrible, miserable, painful, woful, disappointing, hateful, melancholy, mournful, saddening, wretched
delusion	error, fallacy, hallucination, illusion, phantasm	actuality, certainty, fact, reality, truth, verity
demolish	destroy, overthrow, overturn, raze, ruin	build, construct, create, make, repair, restore
demonstration	certainty, consequence, evidence, inference, conclusion, deduction, induction, proof	
design	aim, final cause, object, proposal, device, intent, plan, purpose, end, intention, project, scheme	
desire	appetency, concupiscence, hankering, proclivity, appetite, coveting, inclination, propensity, aspiration, craving, longing, wish	
despair	desperation, despondency, discouragement, hopelessness	anticipation, cheer, courage, encouragement, expectation, hopefulness, assurance, confidence, elation, expectancy, hope, trust
dexterity	adroitness, aptitude, cleverness, expertness, readiness, skill	
diction	expression, phrase, style, vocabulary, language, phraseology, verbiage, wording	
die	cease, decline, expire, perish, decease, depart, fade, wither	be born, come into being, flourish, rise again, begin, come to life, grow, rise from the dead, be immortal, exist, live, survive
difference	contrariety, discrimination, distinction, inequality, contrast, disparity, divergence, unlikeness, disagreement, dissimilarity, diversity, variation, discrepancy, dissimilitude, inconsistency, variety	agreement, harmony, likeness, sameness, uniformity, consonance, identity, resemblance, similarity, unity
difficult	arduous, hard, onerous, toilsome, exhausting, laborious, severe, trying	easy, facile, light, pleasant, slight, trifling, trivial
direction	aim, bearing, course, inclination, tendency, way	
discern	behold, discriminate, observe, recognize, descry, distinguish, perceive, see	
discover	ascertain, detect, disclose, ferret out, find out, descry, discern, expose, find, invent	
disease	affection, disorder, indisposition, sickness, ailment, distemper, infirmity, unhealthiness, complaint, illness, malady, unsoundness	health, robustness, soundness, strength, sturdiness, vigor
disparage	belittle, depreciate, discredit, underestimate, carp at, derogate from, dishonor, underrate, decry, detract from, lower, undervalue	
displace	confuse, derange, disturb, mislay, remove, crowd out, disarrange, jumble, misplace, unsettle	adjust, assort, dispose, order, put in order, set in order, array, classify, group, place, put in place, sort
do	accomplish, carry out, discharge, perform, achieve, carry through, effect, perpetrate, actualize, commit, execute, realize, bring about, complete, finish, transact, bring to pass, consummate, fulfil, work out	baffle, defeat, fail, mar, miss, ruin, come short, destroy, frustrate, miscarry, neglect, spoil
docile	amenable, manageable, pliant, teachable, compliant, obedient, submissive, tractable, gentle, pliable, tame, yielding	determined, firm, intractable, opinionated, self-willed, wilful, dogged, inflexible, obstinate, resolute, stubborn, unyielding
doctrine	article of belief, belief, precept, teaching, article of faith, dogma, principle, tenet	
dogmatic	arrogant, doctrinal, magisterial, positive, authoritative, domineering, opinionated, self-opinionated, dictatorial, imperious, overbearing, systematic	
doubt	distrust, mistrust, surmise, suspect	believe, confide in, depend on, depend upon, rely on, rely upon, trust
doubt	disbelief, incredulity, perplexity, suspense, distrust, indecision, question, suspicion, hesitancy, irresolution, scruple, unbelief, hesitation, misgiving, skepticism, uncertainty	assurance, certainty, conviction, determination, resolution, belief, confidence, decision, persuasion, resolve
draw	allure, drag, haul, induce, lure, tow, attract, entice, incline, lead, pull, tug	alienate, estrange, rebuff, reject, repel, repulse
dream	day-dream, fantasy, reverie, trance, fancy, hallucination, romance, vision	certainty, fact, reality, realization, substance, verity
dress	apparel, clothes, garb, habit, uniform, array, clothing, garments, raiment, vestments, attire, costume, habiliments, robes, vesture	bareness, disarray, dishabille, exposure, nakedness, nudity, undress
drive	compel, propel, repel, resist, thrust, impel, push, repulse, ride, urge on	
duplicate	copy, facsimile, likeness, reproduction, counterpart, imitation, replica, transcript	archetype, model, original, pattern, prototype
duty	accountability, function, office, right, business, obligation, responsibility, righteousness	
eager	animated, desirous, glowing, importunate, longing, anxious, earnest, hot, intense, vehement, ardent, enthusiastic, impatient, intent, yearning, burning, fervent, impetuous, keen, zealous	apathetic, cool, indifferent, regardless, unconcerned, calm, dispassionate, negligent, stolid, uninterested, careless, frigid, phlegmatic, stony, unmindful, cold, heedless, purposeless, stupid, unmoved
ease	easiness, expertness, facility, knack, readiness	annoyance, constraint, discomfort, irritation, trouble, vexation, awkwardness, difficulty, disquiet, perplexity, uneasiness, worry
education	breeding, discipline, learning, study, cultivation, information, nurture, teaching, culture, instruction, reading, training, development, knowledge, schooling, tuition	ignorance, illiteracy
effrontery	assurance, boldness, hardihood, insolence, audacity, brass, impudence, shamelessness	bashfulness, diffidence, sensitiveness, shyness, coyness, modesty, shrinking, timidity
egotism	conceit, self-assertion, self-confidence, self-esteem, egoism, self-conceit, self-consciousness, vanity	bashfulness, diffidence, modesty, self-forgetfulness, unobtrusiveness, deference, humility, self-distrust, shyness, unostentatiousness
emblem	attribute, figure, image, sign, symbol, token, type	
emigrate	immigrate, migrate	
employ	call, engage, engross, hire, make use of, use, use up	
end	break off, close, conclude, expire, quit, terminate, cease, complete, desist, finish, stop, wind up	
end	accomplishment, effect, limit, achievement, expiration, outcome, bound, extent, period, boundary, extremity, point, cessation, finale, purpose, close, finis, result, completion, finish, termination, conclusion, fulfilment, terminus, consequence, goal, tip, consummation, intent, utmost, design, issue, uttermost	
endeavor	attempt, essay, strive, try, undertake	abandon, give up, omit, throw away, dismiss, let go, overlook, throw over, drop, neglect, pass by, throw up
endeavor	attempt, effort, essay, exertion, struggle, trial	
endure	abide, bear, brook, submit to, sustain, afford, bear up under, permit, suffer, tolerate, allow, bear with, put up with, support, undergo	break, despair, fail, fall, give out, sink, surrender, break down, droop, faint, falter, give up, succumb, yield
enemy	adversary, antagonist, competitor, foe, opponent, rival	abettor, accessory, accomplice, ally, friend, helper, supporter
enmity	acrimony, bitterness, ill will, malignity, animosity, hatred, malevolence, rancor, antagonism, hostility, malice, spite	agreement, amity, friendship, kindliness, regard, alliance, concord, harmony, kindness, sympathy
entertain	amuse, cheer, disport, enliven, interest, please, beguile, delight, divert, gratify, occupy, recreate	annoy, bore, busy, disquiet, distract, disturb, tire, weary
entertainment	amusement, diversion, fun, pleasure, cheer, enjoyment, merriment, recreation, delight, frolic, pastime, sport	ennui, fatigue, labor, lassitude, toil, weariness, work
enthusiasm	ardor, excitement, frenzy, transport, devotion, extravagance, inspiration, vehemence, eagerness, fanaticism, intensity, warmth, earnestness, fervency, passion, zeal, ecstasy, fervor, rapture	calculation, caution, deadness, indifference, policy, timidity, calmness, coldness, dulness, lukewarmness, prudence, wariness
entrance	access, approach, gate, introduction, accession, door, gateway, opening, adit, doorway, ingress, penetration, admission, entrée, inlet, portal, admittance, entry	departure, ejection, exit, refusal, withdrawal, egress, exclusion, expulsion, rejection
envious	jealous, suspicious	contented, friendly, kindly, satisfied, trustful, well-disposed
equivocal	ambiguous, enigmatical, indistinct, questionable, doubtful, indefinite, obscure, suspicious, dubious, indeterminate, perplexing, uncertain, enigmatic	certain, evident, lucid, perspicuous, unequivocal, clear, indisputable, manifest, plain, unquestionable, distinct, indubitable, obvious, unambiguous, unquestioned
esteem	appreciate, consider, estimate, prize, think, calculate, deem, hold, regard, value	
esteem	estimate, estimation, favor, regard, respect	abhorrence, aversion, dislike, loathing, antipathy, contempt, hatred, repugnance
eternal	deathless, fadeless, never-failing, undying, endless, immortal, perennial, unending, eonian, imperishable, perpetual, unfading, everlasting, interminable, timeless, unfailing, ever-living, never-ending, unceasing, without end	
event	case, contingency, fortune, outcome, chance, end, incident, possibility, circumstance, episode, issue, result, consequence, fact, occurrence, sequel	
every	all, any, both, each, either	
evident	apparent, glaring, overt, tangible, clear, indubitable, palpable, transparent, conspicuous, manifest, patent, unmistakable, discernible, obvious, perceptible, visible, distinct, open, plain	concealed, impalpable, latent, secret, unknown, covert, impenetrable, obscure, undiscovered, unseen, dark, imperceptible, occult, unimagined, unthought-of, hidden, invisible
example	archetype, ideal, prototype, type, ensample, model, sample, warning, exemplar, pattern, specimen, exemplification, precedent, standard	
excess	dissipation, lavishness, redundance, surplus, exorbitance, overplus, redundancy, waste, extravagance, prodigality, superabundance, wastefulness, intemperance, profusion, superfluity	dearth, destitution, frugality, lack, scantiness, defect, economy, inadequacy, need, shortcoming, deficiency, failure, insufficiency, poverty, want
execute	administer, carry out, do, enforce, perform	
exercise	act, application, exertion, performance, action, drill, occupation, practise, activity, employment, operation, use	idleness, inaction, inactivity, relaxation, rest
expense	cost, expenditure, outgo, outlay	gain, proceeds, profit, receipt, return, income, product, profits, receipts, returns
explicit		ambiguous, implicit, indefinite, uncertain, doubtful, implied, indeterminate, vague
extemporaneous	extemporary, impromptu, offhand, extempore, improvised, unpremeditated	elaborated, premeditated, prepared, read, recited, studied, written
exterminate	annihilate, eradicate, overthrow, uproot, banish, expel, remove, wipe out, destroy, extirpate, root out	augment, breed, cherish, develop, increase, populate, replenish, beget, build up, colonize, foster, plant, propagate, settle
faint	dim, fatigued, irresolute, weak, exhausted, feeble, languid, wearied, faded, half-hearted, listless, worn, faint-hearted, ill-defined, purposeless, worn down, faltering, indistinct, timid, worn out	bright, clear, daring, fresh, resolute, sturdy, brilliant, conspicuous, energetic, hearty, strong, vigorous
