abandon	abdicate, desert, leave, resign, abjure, discontinue, quit, retire from, cast off, forego, recant, retract, cease, forsake, relinquish, surrender, cede, forswear, renounce, vacate, depart from, give up, repudiate, withdraw from	adopt, defend, occupy, seek, advocate, favor, prosecute, support, assert, haunt, protect, undertake, cherish, hold, pursue, uphold, claim, keep, retain, vindicate, court, maintain
abase	bring low, depress, dishonor, lower, cast down, discredit, humble, reduce, debase, disgrace, humiliate, sink, degrade	advance, elevate, honor, raise, aggrandize, exalt, promote, uplift, dignify
abash	bewilder, daunt, embarrass, mortify, chagrin, discompose, humble, overawe, confound, disconcert, humiliate, shame, confuse, dishearten	animate, cheer, encourage, rally, buoy, embolden, inspirit, uphold
abate	decline, ebb, mitigate, reduce, decrease, lessen, moderate, subside, diminish, lower	aggravate, enhance, foment, rage, amplify, enlarge, increase, raise, continue, extend, magnify, revive, develop
abbreviation	abridgment, contraction	
abet	advocate, countenance, incite, sanction, aid, embolden, instigate, support, assist, encourage, promote, uphold	baffle, deter, dissuade, hinder, confound, disapprove, expose, impede, counteract, disconcert, frustrate, obstruct, denounce, discourage
abhor	abominate, dislike, loathe, scorn, despise, hate, nauseate, shun, detest	admire, crave, esteem, love, approve, desire, like, relish, covet, enjoy
abide	anticipate, dwell, remain, stop, await, endure, reside, tarry, bear, expect, rest, tolerate, bide, inhabit, sojourn, wait, confront, live, stay, watch, continue, lodge	abandon, forfeit, migrate, reject, avoid, forfend, move, resist, depart, journey, proceed, shun
abolish	abate, eradicate, prohibit, stamp out, abrogate, exterminate, remove, subvert, annihilate, extirpate, repeal, supplant, annul, nullify, reverse, suppress, destroy, obliterate, revoke, terminate, end, overthrow, set aside	authorize, establish, reinstate, revive, cherish, institute, renew, set up, confirm, introduce, repair, support, continue, legalize, restore, sustain, enact, promote
abomination	abhorrence, curse, hatred, plague, abuse, detestation, horror, shame, annoyance, disgust, iniquity, villainy, aversion, evil, nuisance, wickedness, crime, execration, offense	affection, blessing, enjoyment, joy, appreciation, delight, esteem, satisfaction, approval, desire, gratification, treat, benefit
abridgment	abbreviation, compend, epitome, summary, abstract, compendium, outline, synopsis, analysis, digest	
absolute	arbitrary, compulsory, haughty, peremptory, arrogant, controlling, imperative, positive, authoritative, despotic, imperious, supreme, autocratic, dictatorial, irresponsible, tyrannical, coercive, dogmatic, lordly, unconditional, commanding, domineering, overbearing, unequivocal, compulsive, exacting	accountable, constitutional, gentle, lowly, responsible, complaisant, contingent, humble, meek, submissive, compliant, docile, lenient, mild, yielding, conditional, ductile, limited
absolve	acquit, exculpate, forgive, pardon, clear, exempt, free, release, discharge, exonerate, liberate, set free	accuse, charge, condemn, impeach, obligate, bind, compel, convict, inculpate, oblige
absorb	consume, engross, suck up, take in, drink in, exhaust, swallow, take up, drink up, imbibe, swallow up	cast out, dissipate, emit, put forth, shoot forth, disgorge, distract, exude, radiate, throw off, disperse, eject, give up, send out, vomit
abstinence	abstemiousness, frugality, self-denial, sobriety, continence, moderation, self-restraint, temperance, fasting, self-control	drunkenness, greed, reveling, sensuality, excess, intemperance, revelry, wantonness, gluttony, intoxication, self-indulgence
abstract	appropriate, distract, purloin, steal, detach, divert, remove, take away, discriminate, eliminate, separate, withdraw, distinguish	add, complete, fill up, restore, unite, combine, conjoin, increase, strengthen
abstracted	absent, heedless, listless, preoccupied, absent-minded, inattentive, negligent, thoughtless, absorbed, indifferent, oblivious	alert, on hand, ready, wide-awake, attentive, prompt, thoughtful
absurd	anomalous, ill-considered, ludicrous, ridiculous, chimerical, ill-judged, mistaken, senseless, erroneous, inconclusive, monstrous, stupid, false, incorrect, nonsensical, unreasonable, foolish, infatuated, paradoxical, wild, ill-advised, irrational, preposterous	certain, incontrovertible, rational, substantial, consistent, indisputable, reasonable, true, demonstrable, indubitable, sagacious, undeniable, demonstrated, infallible, sensible, unquestionable, established, logical, sound, wise, incontestable
abuse	aggrieve, impose on or, oppress, ruin, damage, upon, persecute, slander, defame, injure, pervert, victimize, defile, malign, prostitute, vilify, disparage, maltreat, rail at, violate, harm, misemploy, ravish, vituperate, ill-treat, misuse, reproach, wrong, ill-use, molest, revile	applaud, conserve, favor, protect, sustain, benefit, consider, laud, regard, tend, care for, eulogize, panegyrize, respect, uphold, cherish, extol, praise, shield, vindicate
accessory	abetter or abettor, associate, companion, henchman, accomplice, attendant, confederate, participator, ally, coadjutor, follower, partner, assistant, colleague, helper, retainer	adversary, chief, foe, leader, principal, antagonist, commander, hinderer, opponent, rival, betrayer, enemy, instigator, opposer
accident	adventure, contingency, happening, misfortune, calamity, disaster, hazard, mishap, casualty, fortuity, incident, possibility, chance, hap, misadventure	appointment, decree, intention, ordainment, preparation, calculation, fate, law, ordinance, provision, certainty, foreordination, necessity, plan, purpose
acquaintance	association, experience, fellowship, intimacy, companionship, familiarity, friendship, knowledge	ignorance, ignoring, inexperience, unfamiliarity
acrimony	acerbity, harshness, severity, tartness, asperity, malignity, sharpness, unkindness, bitterness, moroseness, sourness, virulence, causticity	amiability, gentleness, kindness, smoothness, courtesy, good nature, mildness, sweetness
act	accomplishment, execution, movement, achievement, exercise, operation, action, exertion, performance, consummation, exploit, proceeding, deed, feat, transaction, doing, motion, work, effect	cessation, immobility, inertia, quiet, suffering, deliberation, inaction, passion[A], repose, suspension, endurance, inactivity, quiescence, rest
active	agile, energetic, officious, sprightly, alert, expeditious, prompt, spry, brisk, industrious, quick, supple, bustling, lively, ready, vigorous, busy, mobile, restless, wide awake, diligent, nimble	dull, inactive, lazy, slow, heavy, indolent, quiescent, sluggish, idle, inert, quiet, stupid
acumen	acuteness, insight, perspicacity, sharpness, cleverness, keenness, sagacity, shrewdness, discernment, penetration	bluntness, dulness, obtuseness, stupidity
add	adjoin, annex, augment, extend, make up, affix, append, cast up, increase, subjoin, amplify, attach, enlarge, join on, sum up	abstract, diminish, lessen, remove, withdraw, deduct, dissever, reduce, subtract
addicted	abandoned, devoted, given over, inclined, accustomed, disposed, given up, prone, attached, given, habituated, wedded	averse, disinclined, indisposed, unaccustomed
address	cost, approach, hail, speak to, apostrophize, court, salute, woo, appeal, greet	avoid, elude, overlook, pass by, cut, ignore, pass, shun
address	adroitness, discretion, manners, readiness, courtesy, ingenuity, politeness, tact, dexterity	awkwardness, clumsiness, ill-breeding, stupidity, boorishness, fatuity, ill manners, unmannerliness, clownishness, folly, rudeness, unwisdom
adequate	able, competent, fitted, satisfactory, adapted, equal, fitting, sufficient, capable, fit, qualified, suitable, commensurate	disqualified, inferior, unequal, unsatisfactory, useless, inadequate, insufficient, unfit, unsuitable, worthless, incompetent, poor, unqualified
adherent	aid, ally, disciple, partisan, supporter, aider, backer, follower	adversary, betrayer, enemy, opponent, traitor, antagonist, deserter, hater, renegade
adhesive	cohesive, gummy, sticky, viscous, glutinous, sticking, viscid	free, inadhesive, loose, separable
adjacent	abutting, bordering, contiguous, neighboring, adjoining, close, coterminous, next, attached, conterminous, near, nigh, beside	detached, disconnected, disjoined, distant, remote, separate
admire	adore, delight in, extol, respect, venerate, applaud, enjoy, honor, revere, wonder, approve, esteem, love	abhor, contemn, detest, execrate, ridicule, abominate, despise, dislike, hate, scorn
adorn	beautify, decorate, garnish, illustrate, bedeck, embellish, gild, ornament, deck	deface, deform, disfigure, mar, spoil
affront	aggravate, exasperate, offend, vex, annoy, insult, provoke, wound, displease, irritate, tease	conciliate, content, gratify, honor, please
agent	actor, factor, means, operator, promoter, doer, instrument, mover, performer	chief, inventor, originator, principal
agree	accede, admit, coincide, concur, accept, approve, combine, consent, accord, assent, comply, harmonize, acquiesce	contend, demur, disagree, oppose, contradict, deny, dispute, protest, decline, differ, dissent, refuse
agriculture	cultivation, gardening, kitchen-gardening, culture, horticulture, market-gardening, farming, husbandry, tillage, floriculture	
aim	aspiration, endeavor, intention, tendency, design, goal, mark, determination, inclination, object, end, intent, purpose	aimlessness, heedlessness, negligence, purposelessness, avoidance, neglect, oversight, thoughtlessness, carelessness
air	appearance, demeanor, manner, sort, bearing, expression, mien, style, behavior, fashion, port, way, carriage, look	
airy	aerial, ethereal, frolicsome, joyous, lively, animated, fairylike, gay, light, sprightly	clumsy, heavy, ponderous, sluggish, wooden, dull, inert, slow, stony
alarm	affright, disquietude, fright, solicitude, apprehension, dread, misgiving, terror, consternation, fear, panic, timidity, dismay	assurance, calmness, confidence, repose, security
alert	active, lively, prepared, vigilant, brisk, nimble, prompt, watchful, hustling, on the watch, ready, wide-awake	drowsy, dull, heavy, inactive, slow, sluggish, stupid
alien	conflicting, distant, inappropriate, strange, contradictory, foreign, irrelevant, unconnected, contrary, hostile, opposed, unlike, contrasted, impertinent, remote	akin, apropos, germane, proper, appropriate, essential, pertinent, relevant
alien	foreigner, stranger	citizen, fellow-countryman, native-born inhabitant, countryman, native, naturalized person
alike	akin, equivalent, kindred, same, analogous, homogeneous, like, similar, equal, identical, resembling, uniform	different, dissimilar, distinct, heterogeneous, unlike
alive	active, breathing, live, quick, alert, brisk, lively, subsisting, animate, existent, living, vivacious, animated, existing	dead, defunct, dull, lifeless, deceased, dispirited, inanimate, spiritless
allay	alleviate, compose, quiet, still, appease, mollify, soothe, tranquilize, calm, pacify	agitate, excite, kindle, rouse, stir up, arouse, fan, provoke, stir
allege	adduce, asseverate, claim, maintain, produce, advance, assign, declare, offer, say, affirm, aver, introduce, plead, state, assert, cite	
allegiance	devotion, fealty, loyalty, obedience, subjection, faithfulness, homage	disaffection, disloyalty, rebellion, sedition, treason
allegory	fable, fiction, illustration, metaphor, parable, simile	chronicle, fact, history, narrative, record
alleviate	abate, lighten, reduce, remove, assuage, mitigate, relieve, soften, lessen, moderate	aggravate, embitter, heighten, intensify, make worse, augment, enhance, increase, magnify
alliance	coalition, confederation, fusion, partnership, compact, federation, league, union, confederacy	antagonism, disunion, enmity, schism, separation, discord, divorce, hostility, secession, war
allot	appoint, destine, give, portion out, apportion, distribute, grant, select, assign, divide, mete out, set apart, award	appropriate, deny, resume, seize, confiscate, refuse, retain, withhold
allow	admit, consent to, let, sanction, tolerate, concede, grant, permit, suffer, yield	deny, disapprove, protest, reject, withstand, disallow, forbid, refuse, resist
alloy	admixture, adulteration, debasement, deterioration	
allude	advert, indicate, intimate, point, signify, hint, insinuate, mention, refer, suggest, imply	
allure	attract, captivate, decoy, entice, lure, tempt, cajole, coax, draw, inveigle, seduce, win	chill, damp, deter, dissuade, drive away, repel, warn
also	as well, in addition, likewise, too, as well as, in like manner, similarly, withal, besides	but, nevertheless, on the contrary, yet, in spite of, notwithstanding, on the other hand
alternative	choice, election, option, pick, preference, resource	compulsion, necessity
amass	accumulate, collect, heap up, hoard up, store up, aggregate, gather, hoard, pile up	disperse, divide, portion, spend, waste, dissipate, parcel, scatter, squander
amateur	connoisseur, critic, dilettante, novice, tyro	
amazement	admiration, awe, confusion, surprise, astonishment, bewilderment, perplexity, wonder	anticipation, composure, expectation, preparation, steadiness, calmness, coolness, indifference, self-possession, stoicism
ambition	aspiration, competition, emulation, opposition, rivalry	carelessness, contentment, humility, indifference, satisfaction
amend	advance, correct, meliorate, rectify, ameliorate, emend, mend, reform, better, improve, mitigate, repair, cleanse, make better, purify	aggravate, debase, harm, mar, tarnish, blemish, depress, impair, spoil, vitiate, corrupt, deteriorate, injure
amiable	agreeable, engaging, lovable, pleasing, attractive, gentle, lovely, sweet, benignant, good-natured, loving, winning, harming, kind, pleasant, winsome	acrimonious, crusty, hateful, ill-tempered, surly, churlish, disagreeable, ill-conditioned, morose, unamiable, crabbed, dogged, ill-humored, sour, unlovely, cruel, gruff, ill-natured, sullen
amid	amidst, amongst, betwixt, mingled with, among, between, in the midst of, surrounded by	afar from, away from, beyond, far from, outside, without
amplify	augment, dilate, expand, extend, unfold, develop, enlarge, expatiate, increase, widen	abbreviate, amputate, condense, cut down, reduce, summarize, abridge, "boil down", curtail, epitomize, retrench, sum up
analogy	affinity, likeness, relation, similarity, coincidence, parity, resemblance, simile, comparison, proportion, semblance, similitude	disagreement, disproportion, dissimilarity, incongruity, unlikeness
anger	animosity, fury, offense, rage, choler, impatience, passion, resentment, displeasure, indignation, peevishness, temper, exasperation, ire, pettishness, vexation, fretfulness, irritation, petulance, wrath	amiability, gentleness, long-suffering, patience, peacefulness, charity, leniency, love, peace, self-control, forbearance, lenity, mildness, peaceableness, self-restraint
animal	beast, fauna, living organism, sentient being, brute, living creature	angel, man, mind, soul, substance (material), inanimate object, matter, mineral, spirit, vegetable
announce	advertise, give notice (of), proclaim, reveal, circulate, give out, promulgate, say, communicate, herald, propound, spread abroad, declare, make known, publish, state, enunciate, notify, report, tell	bury, cover (up), hush, keep secret, suppress, conceal, hide, keep back, secrete, withhold
answer	rejoinder, repartee, reply, response, retort	
anticipate	apprehend, forecast, hope, expect, foretaste, look forward to	despair of, distrust, doubt, dread, fear, recall, recollect, remember
anticipation	antepast, expectation, foresight, hope, apprehension, foreboding, foretaste, presentiment, expectancy, forecast, forethought, prevision	astonishment, despair, dread, fear, surprise, consummation, doubt, enjoyment, realization, wonder
antipathy	abhorrence, disgust, hatred, repugnance, antagonism, dislike, hostility, repulsion, aversion, distaste, opposition, uncongeniality, detestation	affinity, attraction, fellow-feeling, kindliness, sympathy, agreement, congeniality, harmony, regard
antique	ancient, old-fashioned, quaint, superannuated, antiquated	fashionable, fresh, modern, modish, new, recent, stylish
anxiety	anguish, disquiet, foreboding, perplexity, apprehension, disturbance, fretfulness, solicitude, care, dread, fretting, trouble, concern, fear, misgiving, worry	apathy, calmness, confidence, light-heartedness, satisfaction, assurance, carelessness, ease, nonchalance, tranquillity
apathy	calmness, indifference, quietness, stoicism, composure, insensibility, quietude, tranquillity, immobility, lethargy, sluggishness, unconcern, impassibility, phlegm, stillness, unfeelingness	agitation, disturbance, feeling, sensibility, sympathy, alarm, eagerness, frenzy, sensitiveness, turbulence, anxiety, emotion, fury, storm, vehemence, care, excitement, passion, susceptibility, violence, distress
apiece	distributively, each, individually, separately, severally	accumulatively, confusedly, indiscriminately, together, unitedly, collectively, en masse, synthetically
apology	acknowledgment, defense, excuse, plea, confession, exculpation, justification, vindication	accusation, charge, condemnation, injury, offense, censure, complaint, imputation, insult, wrong
apparent	likely, presumable, probable, seeming	doubtful, dubious, improbable, unimaginable, unlikely
appear	have the appearance or semblance, look, seem	be, be certain real or true, be the fact, exist
appendage	accessory, addition, appurtenance, concomitant, accompaniment, adjunct, attachment, extension, addendum, appendix, auxiliary, supplement	main body, original, total, whole
appetite	appetency, impulse, lust, propensity, craving, inclination, passion, relish, desire, liking, proclivity, thirst, disposition, longing, proneness, zest	antipathy, detestation, dislike, distaste, indifference, repugnance, aversion, disgust, disrelish, hatred, loathing, repulsion
apportion	allot, appropriate, deal, distribute, grant, appoint, assign, dispense, divide, share	cling to, consolidate, gather together, receive, collect, divide arbitrarily, keep together, retain
approximation	approach, likeness, neighborhood, resemblance, contiguity, nearness, propinquity, similarity	difference, distance, error, remoteness, unlikeness, variation
arms	accouterments, armor, harness, mail, weapons	
army	armament, forces, military, soldiers, array, host, multitude, soldiery, force, legions, phalanx, troops	
arraign	accuse, charge, impeach, prosecute, censure, cite, indict, summon	acquit, discharge, exonerate, overlook, release, condone, excuse, forgive, pardon, set free
array	army, collection, line of battle, parade, arrangement, disposition, order, show, battle array, exhibition, order of battle, sight	
arrest	apprehend, detain, restrain, stop, capture, hold, secure, take into custody, catch, make prisoner, seize, take prisoner	discharge, dismiss, free, liberate, release, set free
artifice	art, craft, finesse, invention, stratagem, blind, cunning, fraud, machination, subterfuge, cheat, device, guile, maneuver, trick, contrivance, dodge, imposture, ruse, wile	artlessness, fairness, guilelessness, ingenuousness, openness, sincerity, candor, frankness, honesty, innocence, simplicity, truth
artist	artificer, artisan, mechanic, operative, workman	
ask	beg, crave, entreat, petition, request, solicit, beseech, demand, implore, pray, require, supplicate	claim, command, deny, enforce, exact, extort, insist, refuse, reject
associate	accomplice, coadjutor, comrade, fellow, mate, ally, colleague, confederate, friend, partner, chum, companion, consort, helpmate, peer	antagonist, enemy, foe, hinderer, opponent, opposer, rival, stranger
association	alliance, confederacy, familiarity, lodge, club, confederation, federation, participation, community, conjunction, fellowship, partnership, companionship, connection, fraternity, society, company, corporation, friendship, union	disintegration, independence, isolation, separation, solitude
assume	accept, arrogate, postulate, put on, affect, claim, presume, take, appropriate, feign, pretend, usurp	
assurance	arrogance, boldness, impudence, self-confidence, assertion, confidence, presumption, self-reliance, assumption, effrontery, self-assertion, trust	bashfulness, consternation, distrust, hesitancy, shyness, confusion, dismay, doubt, misgiving, timidity
astute	acute, discerning, penetrating, sharp, clear-sighted, discriminating, penetrative, shrewd, crafty, keen, perspicacious, subtile, cunning, knowing, sagacious, subtle	blind, idiotic, shallow, stolid, undiscerning, dull, imbecile, short-sighted, stupid, unintelligent
attachment	adherence, devotion, friendship, regard, adhesion, esteem, inclination, tenderness, affection, estimation, love, union	alienation, aversion, distance, estrangement, repugnance, animosity, coolness, divorce, indifference, separation, antipathy, dislike, enmity, opposition, severance
attack	assail, beset, combat, invade, assault, besiege, encounter, set upon, beleaguer, charge, fall upon, storm	aid, cover, protect, shelter, support, uphold, befriend, defend, resist, shield, sustain, withstand
attack	aggression, incursion, invasion, onslaught, assault, infringement, onset, trespass, encroachment, intrusion	defense, repulsion, resistance, retreat, submission, surrender
attain	accomplish, arrive at, gain, master, reach, achieve, compass, get, obtain, secure, acquire, earn, grasp, procure, win	abandon, fail, forfeit, give up, let go, lose, miss
attitude	pose, position, posture	
attribute	ascribe, associate, connect, impute, refer, assign, charge	deny, disconnect, dissociate, separate, sever, sunder
attribute	property, quality	being, essence, nature, substance
augur	betoken, divine, foretell, predict, prognosticate, bode, forebode, portend, presage, prophesy	assure, demonstrate, establish, make sure, settle, calculate, determine, insure, prove, warrant
authentic	accepted, certain, original, sure, accredited, current, real, true, authoritative, genuine, received, trustworthy, authorized, legitimate, reliable, veritable	apocryphal, counterfeit, exploded, false, spurious, baseless, disputed, fabulous, fictitious, unauthorized
auxiliary	accessory, ally, coadjutor, helper, promoter, aid, assistant, confederate, mercenary, subordinate	antagonist, hinderer, opponent, opposer
avaricious	close, greedy, niggardly, penurious, sordid, covetous, miserly, parsimonious, rapacious, stingy	bountiful, free, generous, liberal, munificent, prodigal, wasteful
avenge	punish, retaliate, revenge, vindicate, visit	
avow	knowledge, aver, confess, own, profess, testify, admit, avouch, declare, proclaim, protest, witness	contradict, deny, disavow, disclaim, disown, ignore, repudiate
awful	alarming, direful, frightful, majestic, solemn, appalling, dread, grand, noble, stately, august, dreadful, horrible, portentous, terrible, dire, fearful, imposing, shocking, terrific	base, contemptible, inferior, paltry, beggarly, despicable, lowly, undignified, commonplace, humble, mean, vulgar
awkward	boorish, clumsy, rough, unhandy, bungling, gawky, uncouth, unskilful, clownish, maladroit, ungainly	adroit, clever, dexterous, handy, skilful
axiom		absurdity, contradiction, demonstration, nonsense, paradox, sophism
babble	blab, cackle, gabble, murmur, prattle, blurt, chat, gossip, palaver, tattle, blurt out, chatter, jabber, prate, twaddle	
banish	ban, dismiss, evict, expatriate, ostracize, discharge, drive out, exile, expel, oust, dislodge, eject	
bank	beach, bound, brink, edge, margin, shore, border, brim, coast, marge, rim, strand	
banter	badinage, derision, jeering, raillery, sarcasm, chaff, irony, mockery, ridicule, satire	
barbarous	atrocious, brutal, merciless, uncivilized, barbarian, cruel, rude, uncouth, barbaric, inhuman, savage, untamed	civilized, cultured, elegant, humane, polite, tender, courtly, delicate, graceful, nice, refined, urbane
barrier	bar, bulwark, obstruction, rampart, barricade, hindrance, parapet, restraint, breastwork, obstacle, prohibition, restriction	admittance, opening, road, transit, entrance, passage, thoroughfare, way
battle	action, combat, encounter, passage of arms, affair, conflict, engagement, skirmish, bout, contest, fight, strife	armistice, concord, peace, suspension of hostilities, truce
beat	bastinado, chastise, overcome, spank, thrash, batter, conquer, pommel, strike, vanquish, belabor, cudgel, pound, surpass, whip, bruise, defeat, scourge, switch, worst, castigate, flog, smite	fail, fall, get the worst of, go down, go under, surrender
beautiful	attractive, charming, exquisite, handsome, beauteous, comely, fair, lovely, bewitching, delightful, fine, picturesque, bonny, elegant, graceful, pretty	awkward, frightful, grotesque, repulsive, uncouth, clumsy, ghastly, hideous, shocking, ungainly, deformed, grim, horrid, ugly, unlovely, disgusting, grisly, odious, unattractive, unpleasant
because	as, for, inasmuch as, since	altho, however, nevertheless, notwithstanding, yet
becoming	befitting, congruous, fit, meet, seemly, beseeming, decent, fitting, neat, suitable, comely, decorous, graceful, proper, worthy	awkward, ill-fitting, indecent, unbecoming, unseemly, ill-becoming, improper, indecorous, unfit, unsuitable
beginning	arising, inauguration, origin, source, commencement, inception, outset, spring, fount, initiation, rise, start, fountain, opening	
behavior	action, breeding, conduct, deportment, manner, bearing, carriage, demeanor, life, manners	
bend	bias, curve, diverge, mold, submit, twist, bow, deflect, incline, persuade, turn, warp, crook, deviate, influence, stoop, twine, yield	
